{
  "version": 1,
  "revision": 1,
  "kind": "series",
  "visibility": "author_only",
  "status": "outline",
  "chapter_plan": "storyboard/chapters.json",
  "macro_story": "storyboard/chapter-stories.json",
  "macro_revision": 3,
  "workflow": {
    "stage": "subsection_outline",
    "branch_design": "deferred",
    "detail_design": "deferred",
    "runtime_binding": "none",
    "original_dialogue": "preserved_in_source_connected_not_replaced_by_summary"
  },
  "origin": "authored",
  "metadata": {
    "addition": true,
    "kind": "new_setting",
    "note": "추가: 기존 메인 이야기를 소단락으로 나눈 편집 구성. 분기 여지는 후속 설계 후보이며 새 선택·전술·영입·상태 실행을 구현하거나 승인한 것이 아니다.",
    "knowledge_policy": "author_reference_not_character_knowledge"
  },
  "carry_policy": "proposed_keys_not_executable_state",
  "notes": [
    "소단락은 하나의 목적을 수행하고 상황이 달라지는 이야기 묶음이다. 대사 한 줄·인사·이동 클릭 단위로 쪼개지 않는다.",
    "모든 소단락은 현재 메인 초안의 필수 읽기 단위다. 원작 선택 방문을 채택한 구간은 부모 큰 이야기의 편집 추가 조건을 상속한다.",
    "분기 후보도 필수 사건과 완료 결과를 숨길 수 없다. variation_scope는 설계 여지이지 이미 존재하는 선택지·실행 조건이 아니다.",
    "reading_next는 현재 초고의 읽기 순서다. after만 논리 의존이며, 독립 병렬 목표의 실행 순서로 승격하지 않는다.",
    "carry_keys는 향후 경로 기록을 설계할 항목의 제안이다. 실제 원고·continuity·발생 ID·공개 체크포인트와 연결하기 전에는 아무 상태도 부여하지 않는다.",
    "각 장은 부모 continuity_limits를 상속하며, 이전 증언·기술·실제 동행과 현재 장비를 구별한다. 미영입 동료의 역할을 먼저 쓰지 않는다.",
    "원문은 source_section_refs가 가리키는 연결 판본에 모두 보존한다. 요약을 원문 전체를 대체하는 본문으로 취급하거나 배타 응답을 한 경로에 합치지 않는다.",
    "9장의 두 봉인은 둘 다 필수지만 순서는 자유롭다. 서로 다른 동굴의 지식과 결과는 실제 수행 전 공유하지 않는다.",
    "성전·공통 시설의 별도 원문은 이 메인 분할로 삭제하거나 자동 방문 처리하지 않는다. 별도 이야기의 연결 지점은 후속 설계에서 정한다.",
    "기존 첫 챕터 본문·선택형 실행·소편 ID는 보존한다. 이 소단락 ID는 새 구성 계층이며 기존 소편 번호와 자동으로 동일하다고 취급하지 않는다."
  ],
  "chapters": [
    {
      "chapter_id": "chapter01",
      "inherit_continuity_from": "storyboard/chapter-stories.json#/chapters/0",
      "exit_requires_beats": [
        "chapter01/arrival",
        "chapter01/audience",
        "chapter01/assignment",
        "chapter01/departure",
        "chapter01/center",
        "chapter01/report"
      ],
      "parallel_groups": [],
      "units": [
        {
          "id": "chapter01/p01",
          "title": [
            {
              "text": "낯선 세계에서 받은 안내"
            }
          ],
          "mandatory": true,
          "status": "outline",
          "macro_stage_refs": [
            "opening"
          ],
          "source_section_refs": [
            "01-invitation"
          ],
          "completes_beats": [
            "chapter01/arrival"
          ],
          "after": [],
          "reading_next": "chapter01/p02",
          "entry": [
            {
              "text": "일행이 이 세계에 들어왔다."
            }
          ],
          "main_content": [
            {
              "ref": {
                "catalog": "characters",
                "id": "protagonist",
                "particle": "은/는"
              }
            },
            {
              "text": " 동료들과 다른 세계에 들어와 "
            },
            {
              "ref": {
                "catalog": "terms",
                "id": "lore"
              }
            },
            {
              "text": "의 성에 도착한다. 성 안의 안내를 따라 이곳을 다스리는 사람에게 가며, 앞으로 맡을 일은 아직 모르는 상태다. 이 도착이 다음 접견의 출발점이 된다."
            }
          ],
          "outcome": [
            {
              "text": "성주를 만나 사정을 들을 자리에 도착한다."
            }
          ],
          "branch": {
            "status": "deferred",
            "mode": "fixed",
            "variation_scope": null,
            "rejoin_before": null,
            "carry_keys": [],
            "main_result_locked": true
          },
          "origin": "authored",
          "metadata": {
            "addition": true,
            "kind": "new_setting",
            "note": "추가: 원문과 큰 이야기의 사건을 하나의 목적·수행·결과 단위로 묶은 편집 요약. 조건·공개 시점은 부모 continuity_limits를 따른다. 필수 사실을 전달하는 구간으로, 의미 없는 응답을 분기화하지 않는다.",
            "knowledge_policy": "author_reference_not_character_knowledge"
          }
        },
        {
          "id": "chapter01/p02",
          "title": [
            {
              "text": "세계의 위기를 듣다"
            }
          ],
          "mandatory": true,
          "status": "outline",
          "macro_stage_refs": [
            "opening"
          ],
          "source_section_refs": [
            "01-audience"
          ],
          "completes_beats": [
            "chapter01/audience"
          ],
          "after": [
            "chapter01/p01"
          ],
          "reading_next": "chapter01/p03",
          "entry": [
            {
              "text": "성주와 첫 접견을 시작한다."
            }
          ],
          "main_content": [
            {
              "ref": {
                "catalog": "characters",
                "id": "lord_ahn",
                "particle": "은/는"
              }
            },
            {
              "text": " 대륙의 침몰과 용암 지대의 발생, 돌아오지 않은 특공대, "
            },
            {
              "ref": {
                "catalog": "characters",
                "id": "necromancer"
              }
            },
            {
              "text": "의 세력 확장을 설명한다. 일행은 서로 떨어진 재난이 지금 맡게 될 큰 임무의 배경임을 듣는다. 아직 원인을 직접 확인한 것은 아니지만 막아야 할 상대와 피해의 범위를 알게 된다."
            }
          ],
          "outcome": [
            {
              "text": "세계의 위기와 궁극적인 상대에 관한 설명을 듣는다."
            }
          ],
          "branch": {
            "status": "deferred",
            "mode": "fixed",
            "variation_scope": null,
            "rejoin_before": null,
            "carry_keys": [],
            "main_result_locked": true
          },
          "origin": "authored",
          "metadata": {
            "addition": true,
            "kind": "new_setting",
            "note": "추가: 원문과 큰 이야기의 사건을 하나의 목적·수행·결과 단위로 묶은 편집 요약. 조건·공개 시점은 부모 continuity_limits를 따른다. 필수 사실을 전달하는 구간으로, 의미 없는 응답을 분기화하지 않는다.",
            "knowledge_policy": "author_reference_not_character_knowledge"
          }
        },
        {
          "id": "chapter01/p03",
          "title": [
            {
              "text": "돌아와 증명해야 할 첫 임무"
            }
          ],
          "mandatory": true,
          "status": "outline",
          "macro_stage_refs": [
            "escalation"
          ],
          "source_section_refs": [
            "01-request"
          ],
          "completes_beats": [
            "chapter01/assignment"
          ],
          "after": [
            "chapter01/p02"
          ],
          "reading_next": "chapter01/p04",
          "entry": [
            {
              "text": "세계의 위기를 들었지만 능력은 인정받지 못했다."
            }
          ],
          "main_content": [
            {
              "text": "성주는 곧바로 최종 상대에게 보내는 대신 "
            },
            {
              "ref": {
                "catalog": "terms",
                "id": "menace"
              }
            },
            {
              "text": "의 중심을 탐사하고 돌아오라고 부탁한다. 일행은 발견과 귀환 보고가 이번 임무의 완료 기준임을 이해한다. 출발 준비와 동굴 탐색은 이 약속을 수행하기 위한 행동으로 이어진다."
            }
          ],
          "outcome": [
            {
              "text": "첫 탐사의 목적지와 완료 기준을 알고 수행하기로 한다."
            }
          ],
          "branch": {
            "status": "deferred",
            "mode": "fixed",
            "variation_scope": null,
            "rejoin_before": null,
            "carry_keys": [],
            "main_result_locked": true
          },
          "origin": "authored",
          "metadata": {
            "addition": true,
            "kind": "new_setting",
            "note": "추가: 원문과 큰 이야기의 사건을 하나의 목적·수행·결과 단위로 묶은 편집 요약. 조건·공개 시점은 부모 continuity_limits를 따른다. 필수 사실을 전달하는 구간으로, 의미 없는 응답을 분기화하지 않는다.",
            "knowledge_policy": "author_reference_not_character_knowledge"
          }
        },
        {
          "id": "chapter01/p04",
          "title": [
            {
              "text": "떠난 사람의 이름과 남은 목소리"
            }
          ],
          "mandatory": true,
          "status": "outline",
          "macro_stage_refs": [
            "escalation"
          ],
          "source_section_refs": [
            "01-city"
          ],
          "completes_beats": [],
          "after": [
            "chapter01/p03"
          ],
          "reading_next": "chapter01/p05",
          "entry": [
            {
              "text": "첫 임무를 맡고 아직 성 안에 있다."
            }
          ],
          "main_content": [
            {
              "text": "출발 전 성 안에서 일행은 특공대를 기다리는 사람들의 사정을 접한다. 유골 앞에서는 "
            },
            {
              "ref": {
                "catalog": "characters",
                "id": "jr_antares"
              }
            },
            {
              "text": "의 목소리를 만나 아버지 "
            },
            {
              "ref": {
                "catalog": "characters",
                "id": "red_antares",
                "particle": "을/를"
              }
            },
            {
              "text": " 찾아 배움을 얻으라는 말을 듣는다. 현재 임무는 동굴 탐사이지만, 여행 중 다시 찾아야 할 이름이 생긴다."
            }
          ],
          "outcome": [
            {
              "text": "앞으로 찾아볼 인물의 이름과 실종자를 기다리는 사정을 기억한다."
            }
          ],
          "branch": {
            "status": "deferred",
            "mode": "candidate",
            "variation_scope": [
              {
                "text": "현재 임무를 바꾸지 않는 범위에서 누구의 사정을 더 깊이 듣는지에 따라 이후 만남에서 떠올릴 대화 경험이 달라질 수 있다. 핵심 이름 전달은 어느 경로에서도 유지한다."
              }
            ],
            "rejoin_before": "chapter01/p05",
            "carry_keys": [
              "experience.castle_testimony"
            ],
            "main_result_locked": true
          },
          "origin": "authored",
          "metadata": {
            "addition": true,
            "kind": "new_setting",
            "note": "추가: 원문과 큰 이야기의 사건을 하나의 목적·수행·결과 단위로 묶은 편집 요약. 조건·공개 시점은 부모 continuity_limits를 따른다. 분기 여지와 인계 키는 집필 제안이며 현재 실행·영입·장비·경험의 확정 사실이 아니다.",
            "knowledge_policy": "author_reference_not_character_knowledge"
          }
        },
        {
          "id": "chapter01/p05",
          "title": [
            {
              "text": "출발할 일행을 정비하다"
            }
          ],